Snowballing: Backward/Forward,Method,Annotator 1,Annotator 2,Origin Paper,,
Puppet: A Declarative Subset of the Puppet Configuration Language,Forward,not-relevant,,Systems Approaches to Tackling Configuration Errors: A Survey,,
Detecting operator errors in cloud maintenance operations,Forward,relevant,,Systems Approaches to Tackling Configuration Errors: A Survey,,
Performance Health Index for Complex Cyber Infrastructures,Forward,not-relevant,,Systems Approaches to Tackling Configuration Errors: A Survey,,
Can we use programmer's knowledge? fixing parameter configuration errors in hadoop through analyzing q&a sites,Forward,not-relevant,,Systems Approaches to Tackling Configuration Errors: A Survey,,
Efficient Big-Data Access: Taxonomy and a Comprehensive Survey,Forward,not-relevant,,Systems Approaches to Tackling Configuration Errors: A Survey,,
Smt-based robot transition repair,Forward,not-relevant,,Systems Approaches to Tackling Configuration Errors: A Survey,,
CHeSS: A Configuration Health Scoring System and Its Application to Network Devices,Forward,relevant,,Systems Approaches to Tackling Configuration Errors: A Survey,,
A Generic Framework for Structuring Configuration Management for Socio-technical System: Application to Control Rooms,Forward,not-relevant,,Systems Approaches to Tackling Configuration Errors: A Survey,,
Facilitating Connector Evolution With Architecture-Centric Development,Forward,not-relevant,,Systems Approaches to Tackling Configuration Errors: A Survey,,
Cloudcasting: A New architecture for cloud centric networks,Forward,not-relevant,,Systems Approaches to Tackling Configuration Errors: A Survey,,
Managing Configuration Errors in Cloud Computing Using Cluster & Node Management Techniques,Forward,not-relevant,,Systems Approaches to Tackling Configuration Errors: A Survey,,
Attack surface reduction in contemporary operating systems via practical kernel debloating,Forward,not-relevant,,Systems Approaches to Tackling Configuration Errors: A Survey,,
Defining and measuring Puppet code quality,Forward,not-relevant,,Systems Approaches to Tackling Configuration Errors: A Survey,,
Detecting Operator Errors In Cloud Computing Using Anti-Patterns,Forward,relevant,,Systems Approaches to Tackling Configuration Errors: A Survey,,
iConfig: What I See Is What I Configure,Forward,not-relevant,,Systems Approaches to Tackling Configuration Errors: A Survey,,
Research on Application Configuration Management Technology for Cloud Platform,Forward,not-relevant,,Systems Approaches to Tackling Configuration Errors: A Survey,,
Configuration Modeling and Diagnosis in Data Centers,Forward,not-relevant,,Systems Approaches to Tackling Configuration Errors: A Survey,,
Online Detection of Operator Errors in Cloud Computing Using Anti-patterns,Forward,relevant,,Systems Approaches to Tackling Configuration Errors: A Survey,,
Co-diagnosing configuration failures in co-robotic systems,Forward,relevant,,Systems Approaches to Tackling Configuration Errors: A Survey,,
Semantics and provenance of configuration programming language μPuppet,Forward,not-relevant,,Systems Approaches to Tackling Configuration Errors: A Survey,,
A Configuration User Interface for Multi-Cloud Storage Based on Secret Sharing: An Exploratory Design Study,Forward,not-relevant,,Systems Approaches to Tackling Configuration Errors: A Survey,,
SCIBORG: Secure Configurations for the IOT Based on Optimization and Reasoning on Graphs.,Forward,relevant,,Systems Approaches to Tackling Configuration Errors: A Survey,,
A Framework For Misconfiguration Diagnosis in Interconnected Multiparty Systems,Forward,not-relevant,,Systems Approaches to Tackling Configuration Errors: A Survey,,
A Decision-Theoretic Approach to Network Fault Diagnosis and Follow-up Action,Forward,not-relevant,,Systems Approaches to Tackling Configuration Errors: A Survey,,
Method for improving the security of a networked system by adjusting the configuration parameters of the system components,Forward,not-relevant,,Systems Approaches to Tackling Configuration Errors: A Survey,,
The stratosphere platform for big data analytics,Backward,not-relevant,,Systems Approaches to Tackling Configuration Errors: A Survey,,
Hippodrome: Running circles around storage administration,Backward,not-relevant,,Systems Approaches to Tackling Configuration Errors: A Survey,,
Towards a high-level machine configuration system,Backward,not-relevant,,Systems Approaches to Tackling Configuration Errors: A Survey,,
Toward provenance-based security for configuration languages,Backward,not-relevant,,Systems Approaches to Tackling Configuration Errors: A Survey,,
Configuration tools: Working together,Backward,relevant,,Systems Approaches to Tackling Configuration Errors: A Survey,,
Why software is eating the world,Backward,not-relevant,,Systems Approaches to Tackling Configuration Errors: A Survey,,
Above the Clouds: A Berkeley View of Cloud Computing,Backward,not-relevant,,Systems Approaches to Tackling Configuration Errors: A Survey,,
Field studies of computer system administrators: Analysis of system management tools and practices,Backward,not-relevant,,Systems Approaches to Tackling Configuration Errors: A Survey,,
Detecting and resolving policy misconfigurations in access-control systems,Backward,not-relevant,,Systems Approaches to Tackling Configuration Errors: A Survey,,
A few billion lines of code later: Using static analysis to find bugs in the real world,Backward,not-relevant,,Systems Approaches to Tackling Configuration Errors: A Survey,,
Humanaware computer system design,Backward,not-relevant,,Systems Approaches to Tackling Configuration Errors: A Survey,,
Educating system administrators,Backward,not-relevant,,Systems Approaches to Tackling Configuration Errors: A Survey,,
Towards Availability and Maintainability Benchmarks: A Case Study of Software RAID Systems,Backward,not-relevant,,Systems Approaches to Tackling Configuration Errors: A Survey,,
To err is human,Backward,not-relevant,,Systems Approaches to Tackling Configuration Errors: A Survey,,
Undo for Operators: Building an undoable e-mail store,Backward,not-relevant,,Systems Approaches to Tackling Configuration Errors: A Survey,,
A site configuration engine,Backward,not found,,Systems Approaches to Tackling Configuration Errors: A Survey,,
Unassisted and automatic generation of high-coverage tests for complex systems programs,Backward,not-relevant,,Systems Approaches to Tackling Configuration Errors: A Survey,,
Managing energy and server resources in hosting centers,Backward,not-relevant,,Systems Approaches to Tackling Configuration Errors: A Survey,,
Rethinking database system architecture: Towards a selftuning risc-style database system,Backward,not-relevant,,Systems Approaches to Tackling Configuration Errors: A Survey,,
A survey of system configuration tools,Backward,relevant,,Systems Approaches to Tackling Configuration Errors: A Survey,,
A case study in configuration management tool deployment,Backward,not-relevant,,Systems Approaches to Tackling Configuration Errors: A Survey,,
Making system configuration more declarative,Backward,relevant,,Systems Approaches to Tackling Configuration Errors: A Survey,,
Purely functional system configuration management,Backward,relevant,,Systems Approaches to Tackling Configuration Errors: A Survey,,
What have we learnt in 20 years of L4 microkernels?,Backward,not-relevant,,Systems Approaches to Tackling Configuration Errors: A Survey,,
The smartfrog configuration management framework,Backward,relevant,,Systems Approaches to Tackling Configuration Errors: A Survey,,
Design guidelines for system administration tools developed through ethnographic field study,Backward,not-relevant,,Systems Approaches to Tackling Configuration Errors: A Survey,,
"Profiling, what-if analysis, and cost-based optimization of mapreduce programs",Backward,not-relevant,,Systems Approaches to Tackling Configuration Errors: A Survey,,
A declarative approach to automated configuration,Backward,not-relevant,,Systems Approaches to Tackling Configuration Errors: A Survey,,
A survey of system administrator mental models and situation awareness,Backward,not-relevant,,Systems Approaches to Tackling Configuration Errors: A Survey,,
KungfuValley: A systematic configuration validation framework for cloud services,Backward,relevant,,Systems Approaches to Tackling Configuration Errors: A Survey,,
Understanding customer problem troubleshooting from storage system logs,Backward,not found,,Systems Approaches to Tackling Configuration Errors: A Survey,,
The vision of autonomic computing,Backward,not-relevant,,Systems Approaches to Tackling Configuration Errors: A Survey,,
Discovering correctness constraints for self-management of system configuration,Backward,relevant,,Systems Approaches to Tackling Configuration Errors: A Survey,,
The state of the art in end-user software engineering.,Backward,not-relevant,,Systems Approaches to Tackling Configuration Errors: A Survey,,
Programming Language Techniques for Modular Router Configurations,Backward,not-relevant,,Systems Approaches to Tackling Configuration Errors: A Survey,,
Experimental study of internet stability and backbone failures,Backward,not-relevant,,Systems Approaches to Tackling Configuration Errors: A Survey,,
"Dependable computing: Concepts, limits, challenges",Backward,not-relevant,,Systems Approaches to Tackling Configuration Errors: A Survey,,
Auto-configuration by file construction: Configuration management with newfig,Backward,not-relevant,,Systems Approaches to Tackling Configuration Errors: A Survey,,
Getting started with configuration management,Backward,not-relevant,,Systems Approaches to Tackling Configuration Errors: A Survey,,
Against The Use of Programming Languages in Configuration Files,Backward,not-relevant,,Systems Approaches to Tackling Configuration Errors: A Survey,,
Improving user-interface dependability through mitigation of human error,Backward,not-relevant,,Systems Approaches to Tackling Configuration Errors: A Survey,,
Fuzz Revisited: A Re-Examination of the Reliability of UNIX Utilities and Services,Backward,not-relevant,,Systems Approaches to Tackling Configuration Errors: A Survey,,
Improving a human-computer dialogue,Backward,not-relevant,,Systems Approaches to Tackling Configuration Errors: A Survey,,
Network configuration management via model finding,Backward,not-relevant,,Systems Approaches to Tackling Configuration Errors: A Survey,,
Declarative infrastructure configuration synthesis and debugging,Backward,relevant,,Systems Approaches to Tackling Configuration Errors: A Survey,,
Heuristic evaluation of user interfaces,Backward,not-relevant,,Systems Approaches to Tackling Configuration Errors: A Survey,,
Design principles for human-computer interfaces,Backward,not-relevant,,Systems Approaches to Tackling Configuration Errors: A Survey,,
Design rules based on analyses of human error,Backward,not-relevant,,Systems Approaches to Tackling Configuration Errors: A Survey,,
Understanding and validating database system administration,Backward,not-relevant,,Systems Approaches to Tackling Configuration Errors: A Survey,,
Barricade: Defending systems against operator mistakes,Backward,not-relevant,,Systems Approaches to Tackling Configuration Errors: A Survey,,
Finding probably better system configurations quickly,Backward,not-relevant,,Systems Approaches to Tackling Configuration Errors: A Survey,,
Mining for misconfigured machines in grid systems,Backward,not-relevant,,Systems Approaches to Tackling Configuration Errors: A Survey,,
"Recovery-Oriented Computing (ROC): Motivation, Definition, Techniques, and Case Studies",Backward,not-relevant,,Systems Approaches to Tackling Configuration Errors: A Survey,,
Heterogeneity and dynamicity of clouds at scale: Google trace analysis,Backward,not-relevant,,Systems Approaches to Tackling Configuration Errors: A Survey,,
BFT for the skeptics,Backward,not-relevant,,Systems Approaches to Tackling Configuration Errors: A Survey,,
Automatically generating predicates and solutions for configuration troubleshooting,Backward,not-relevant,,Systems Approaches to Tackling Configuration Errors: A Survey,,
Fine-grained access-control for the puppet configuration language,Backward,not-relevant,,Systems Approaches to Tackling Configuration Errors: A Survey,,
Designing tools for system administrators: An empirical test of the integrated user satisfaction model,Backward,not-relevant,,Systems Approaches to Tackling Configuration Errors: A Survey,,
Flight data recorder: Monitoring persistent-state interactions to improve systems management,Backward,not-relevant,,Systems Approaches to Tackling Configuration Errors: A Survey,,
LiveOps: Systems management as a service,Backward,not-relevant,,Systems Approaches to Tackling Configuration Errors: A Survey,,
A smart hill-climbing algorithm for application server configuration,Backward,not-relevant,,Systems Approaches to Tackling Configuration Errors: A Survey,,
A recursive random search algorithm for large-scale network parameter configuration,Backward,not-relevant,,Systems Approaches to Tackling Configuration Errors: A Survey,,
Improving software diagnosability via log enhancement,Backward,relevant,,Systems Approaches to Tackling Configuration Errors: A Survey,,
Why do migrations fail and what can we do about it?,Backward,relevant,,Systems Approaches to Tackling Configuration Errors: A Survey,,
Automatic configuration of internet services,Backward,relevant,,Systems Approaches to Tackling Configuration Errors: A Survey,,
"The good, the bad, and the differences: Better network diagnostics with differential provenance",Forward,not-relevant,,Encore: Exploiting system environment and correlation information for misconfiguration detection,,
Resource provisioning planning for enterprise migration and automated application discovery,Forward,not-relevant,,Encore: Exploiting system environment and correlation information for misconfiguration detection,,
Spatial–temporal prediction models for active ticket managing in data centers,Forward,not-relevant,,Encore: Exploiting system environment and correlation information for misconfiguration detection,,
Managing data center tickets: Prediction and active sizing,Forward,not-relevant,,Encore: Exploiting system environment and correlation information for misconfiguration detection,,
MADneSs: A multi-layer anomaly detection framework for complex dynamic systems,Forward,not-relevant,,Encore: Exploiting system environment and correlation information for misconfiguration detection,,
Operating systems for resource-adaptive intelligent software: Challenges and opportunities,Forward,not-relevant,,Encore: Exploiting system environment and correlation information for misconfiguration detection,,
Delivering software with agility and quality in a cloud environment,Forward,not-relevant,,Encore: Exploiting system environment and correlation information for misconfiguration detection,,
Cloud migration using automated planning,Forward,not-relevant,,Encore: Exploiting system environment and correlation information for misconfiguration detection,,
Enterprise-scale cloud migration orchestrator,Forward,not-relevant,,Encore: Exploiting system environment and correlation information for misconfiguration detection,,
Toward beneficial transformation of enterprise workloads to hybrid clouds,Forward,not-relevant,,Encore: Exploiting system environment and correlation information for misconfiguration detection,,
Explaining inference queries with bayesian optimization,Forward,not-relevant,,Encore: Exploiting system environment and correlation information for misconfiguration detection,,
Differential energy profiling: energy optimization via diffing similar apps,Forward,not-relevant,,Encore: Exploiting system environment and correlation information for misconfiguration detection,,
Automation and orchestration framework for large-scale enterprise cloud migration,Forward,not-relevant,,Encore: Exploiting system environment and correlation information for misconfiguration detection,,
Automated business application discovery,Forward,not-relevant,,Encore: Exploiting system environment and correlation information for misconfiguration detection,,
Acts in need: automatic configuration tuning with scalability guarantees,Forward,not-relevant,,Encore: Exploiting system environment and correlation information for misconfiguration detection,,
Praxi: cloud software discovery that learns from practice,Forward,not-relevant,,Encore: Exploiting system environment and correlation information for misconfiguration detection,,
What is All the FaaS About?-Remote Exploitation of FPGA-as-a-Service Platforms,Forward,not-relevant,,Encore: Exploiting system environment and correlation information for misconfiguration detection,,
Cloud transformation analytics services: a case study of cloud fitness validation for server migration,Forward,not-relevant,,Encore: Exploiting system environment and correlation information for misconfiguration detection,,
Deltasherlock: Identifying changes in the cloud,Forward,not-relevant,,Encore: Exploiting system environment and correlation information for misconfiguration detection,,
"Network troubleshooting: survey, taxonomy and challenges",Forward,not-relevant,,Encore: Exploiting system environment and correlation information for misconfiguration detection,,
Automatic invariant selection for online anomaly detection,Forward,not-relevant,,Encore: Exploiting system environment and correlation information for misconfiguration detection,,
IT troubleshooting with drift analysis in the DevOps era,Forward,not-relevant,,Encore: Exploiting system environment and correlation information for misconfiguration detection,,
"Computing resource transformation, consolidation and decomposition in hybrid clouds",Forward,not-relevant,,Encore: Exploiting system environment and correlation information for misconfiguration detection,,
Automated system change discovery and management in the cloud,Forward,not-relevant,,Encore: Exploiting system environment and correlation information for misconfiguration detection,,
A cloud-native monitoring and analytics framework,Forward,not-relevant,,Encore: Exploiting system environment and correlation information for misconfiguration detection,,
Genetic Algorithms For Tightening Security,Forward,not-relevant,,Encore: Exploiting system environment and correlation information for misconfiguration detection,,
A scheme for X-ray medical image denoising using sparse representations,Forward,not-relevant,,Encore: Exploiting system environment and correlation information for misconfiguration detection,,
Pvad: Privacy-preserving verification for secure routing in ad hoc networks,Forward,not-relevant,,Encore: Exploiting system environment and correlation information for misconfiguration detection,,
File Systems are Hard to Test—Learning from Xfstests,Forward,not-relevant,,Encore: Exploiting system environment and correlation information for misconfiguration detection,,
Popcon: Mining popular software configurations from community,Forward,not-relevant,,Encore: Exploiting system environment and correlation information for misconfiguration detection,,
Relax: Automatic Contention Detection and Resolution for Configuration Related Performance Tuning,Forward,not-relevant,,Encore: Exploiting system environment and correlation information for misconfiguration detection,,
Debugging the Performance of Configurable Software Systems: A Human-Centered White-box Approach,Forward,relevant,,Encore: Exploiting system environment and correlation information for misconfiguration detection,,
Workload Prediction for Efficient Performance Isolation and System Reliability,Forward,not-relevant,,Encore: Exploiting system environment and correlation information for misconfiguration detection,,
Interpreted formalisms for configurations,Forward,relevant,,Encore: Exploiting system environment and correlation information for misconfiguration detection,,
Adaptive Framework for Configuration Tuning,Forward,not-relevant,,Encore: Exploiting system environment and correlation information for misconfiguration detection,,
Version space learning for verification on temporal differentials,Forward,not-relevant,,Encore: Exploiting system environment and correlation information for misconfiguration detection,,
Cloud computing application adaptation as a service,Forward,not-relevant,,Encore: Exploiting system environment and correlation information for misconfiguration detection,,not found
Improving data center efficiency through smart grid integration and intelligent analytics,Forward,not-relevant,,Encore: Exploiting system environment and correlation information for misconfiguration detection,,
Detection and Prevention of Misuse of Software Components,Forward,not-relevant,,Encore: Exploiting system environment and correlation information for misconfiguration detection,,
Leveraging trusted computing and model checking to build dependable virtual machines,Forward,not-relevant,,Encore: Exploiting system environment and correlation information for misconfiguration detection,,
Virtual machine images as structured data: the Mirage image library,Backward,not-relevant,,Encore: Exploiting system environment and correlation information for misconfiguration detection,,
The Role of Domain Knowledge in Data Mining,Backward,not-relevant,,Encore: Exploiting system environment and correlation information for misconfiguration detection,,
Feature Selection via Concave Minimiation and Support Vector Machiens,Backward,not-relevant,,Encore: Exploiting system environment and correlation information for misconfiguration detection,,
KLEE: Unassisted and Automatic Generation of High-Coverage Tests for Complex Systems Programs,Backward,not-relevant,,Encore: Exploiting system environment and correlation information for misconfiguration detection,,
Mining Frequent Pattern without Candidate Generation,Backward,not-relevant,,Encore: Exploiting system environment and correlation information for misconfiguration detection,,
A Component-based software configuration management model and its supporting system,Backward,not-relevant,,Encore: Exploiting system environment and correlation information for misconfiguration detection,,
Privacy-Preserving Friends Troubleshooting Network,Backward,not-relevant,,Encore: Exploiting system environment and correlation information for misconfiguration detection,,
Efficiently Mining Long Patterns from Database,Backward,not-relevant,,Encore: Exploiting system environment and correlation information for misconfiguration detection,,
SLIM: Directly Mining Descriptive Patterns,Backward,not-relevant,,Encore: Exploiting system environment and correlation information for misconfiguration detection,,
Mining Quantative Association Rules in Large Relational Tables,Backward,not-relevant,,Encore: Exploiting system environment and correlation information for misconfiguration detection,,
Bootstrapping an Infrastructure,Backward,not-relevant,,Encore: Exploiting system environment and correlation information for misconfiguration detection,,
Detecting Large-Scale System Problems by Mining Console Logs,Backward,not-relevant,,Encore: Exploiting system environment and correlation information for misconfiguration detection,,
The threat of offensive ai to organizations,Forward,not-relevant,,Learning from Before and After Recovery to Detect Latent Misconfiguration,,
Reboot-based recovery of performance anomalies in adaptive bitrate video-streaming services,Forward,not-relevant,,Learning from Before and After Recovery to Detect Latent Misconfiguration,,
On Run-Time Configuration Engineering,Forward,relevant,,Learning from Before and After Recovery to Detect Latent Misconfiguration,,
The NIST Definition of Cloud Computing,Backward,not-relevant,,Learning from Before and After Recovery to Detect Latent Misconfiguration,,
Nail-it-down: nailing and fixing configuration faults in cloud environments,Backward,relevant,,Learning from Before and After Recovery to Detect Latent Misconfiguration,,
Minerals: using data mining to detect router misconfigurations,Backward,not-relevant,,Learning from Before and After Recovery to Detect Latent Misconfiguration,,
A survey of online failure prediction methods,Backward,not-relevant,,Learning from Before and After Recovery to Detect Latent Misconfiguration,,
Online failure prediction in cloud datacenters by real-time message pattern learning,Backward,not-relevant,,Learning from Before and After Recovery to Detect Latent Misconfiguration,,
Cloud Computing Risk: A Decision-making Framework,Forward,not-relevant,,Misconfiguration detection for cloud datacenters using decision tree analysis,,
Managing limited network access configuration,Forward,not-relevant,,Misconfiguration detection for cloud datacenters using decision tree analysis,,
Datacenter Selection in Cloud Framework for Efficient Load Distribution Using a Fuzzy Approach,Forward,not-relevant,,Misconfiguration detection for cloud datacenters using decision tree analysis,,
"Operationalization of the Metadata Element"" Difficulty""",Forward,not-relevant,,Misconfiguration detection for cloud datacenters using decision tree analysis,,
Object-oriented conceptual programming based on PROT nets,Forward,not-relevant,,Misconfiguration detection for cloud datacenters using decision tree analysis,,
Implementing Chinese Wall security model for cloud-based services,Forward,not-relevant,,Misconfiguration detection for cloud datacenters using decision tree analysis,,
Automatic server role identification for cloud infrastructure construction,Forward,not-relevant,,Misconfiguration detection for cloud datacenters using decision tree analysis,,
Automatic parameter configuration for cloud infrastructures by design pattern extraction,Forward,relevant,,Misconfiguration detection for cloud datacenters using decision tree analysis,,
