Snowballing: Backward/Forward,Method,Annotator 1,Annotator 2,Origin Paper,,
Configuration Policy Extraction for Parameter Settings in Cloud Infrastructure Using UML/OCL Verification,Forward,relevant,,Misconfiguration detection for cloud datacenters using decision tree analysis,,
The Method and Tool of Cost Analysis for Cloud Computing,Backward,not-relevant,,Misconfiguration detection for cloud datacenters using decision tree analysis,,
C4.5: Programs for Machine Learning,Backward,not-relevant,,Misconfiguration detection for cloud datacenters using decision tree analysis,,
Podim: A language for high-level configuration management,Backward,not-relevant,,Misconfiguration detection for cloud datacenters using decision tree analysis,,
Information retrieval,Backward,not-relevant,,Misconfiguration detection for cloud datacenters using decision tree analysis,,
Induction of Decision Trees,Backward,not-relevant,,Misconfiguration detection for cloud datacenters using decision tree analysis,,
A comparison of 10 sampling algorithms for configurable systems,Forward ,relevant,,Where Do Configuration Constraints Stem From? An Extraction Approach and an Empirical Study,,
The state of adoption and the challenges of systematic variability management in industry,Forward ,not-relevant,,Where Do Configuration Constraints Stem From? An Extraction Approach and an Empirical Study,,
Data-efficient performance learning for configurable systems,Forward ,not-relevant,,Where Do Configuration Constraints Stem From? An Extraction Approach and an Empirical Study,,
Automated analysis of feature models: Quo vadis?,Forward ,not-relevant,,Where Do Configuration Constraints Stem From? An Extraction Approach and an Empirical Study,does not match inclusion criteria,
"Test them all, is it worth it? Assessing configuration sampling on the JHipster Web development stack",Forward ,relevant,,Where Do Configuration Constraints Stem From? An Extraction Approach and an Empirical Study,,
Where is my feature and what is it about? a case study on recovering feature facets,Forward ,not-relevant,,Where Do Configuration Constraints Stem From? An Extraction Approach and an Empirical Study,,
Maintaining feature traceability with embedded annotations,Forward ,not-relevant,,Where Do Configuration Constraints Stem From? An Extraction Approach and an Empirical Study,,
A study of feature scattering in the linux kernel,Forward ,not-relevant,,Where Do Configuration Constraints Stem From? An Extraction Approach and an Empirical Study,,
Tackling combinatorial explosion: a study of industrial needs and practices for analyzing highly configurable systems,Forward ,relevant,,Where Do Configuration Constraints Stem From? An Extraction Approach and an Empirical Study,,
Using machine learning to infer constraints for product lines,Forward ,relevant,,Where Do Configuration Constraints Stem From? An Extraction Approach and an Empirical Study,,
SMTIBEA: a hybrid multi-objective optimization algorithm for configuring large constrained software product lines,Forward ,relevant,,Where Do Configuration Constraints Stem From? An Extraction Approach and an Empirical Study,,
Facing the truth: benchmarking the techniques for the evolution of variant-rich systems,Forward ,not-relevant,,Where Do Configuration Constraints Stem From? An Extraction Approach and an Empirical Study,,
Transfer learning across variants and versions: The case of linux kernel size,Forward ,not-relevant,,Where Do Configuration Constraints Stem From? An Extraction Approach and an Empirical Study,,
Propagating configuration decisions with modal implication graphs,Forward ,relevant,,Where Do Configuration Constraints Stem From? An Extraction Approach and an Empirical Study,,
Feature-oriented defect prediction,Forward ,not-relevant,,Where Do Configuration Constraints Stem From? An Extraction Approach and an Empirical Study,,
PEoPL: projectional editing of product lines,Forward ,not-relevant,,Where Do Configuration Constraints Stem From? An Extraction Approach and an Empirical Study,,
Simulating the evolution of clone-and-own projects with VEVOS,Forward ,not-relevant,,Where Do Configuration Constraints Stem From? An Extraction Approach and an Empirical Study,,
Finding lost features in cloned systems,Forward ,not-relevant,,Where Do Configuration Constraints Stem From? An Extraction Approach and an Empirical Study,,
Usage scenarios for a common feature modeling language,Forward ,not-relevant,,Where Do Configuration Constraints Stem From? An Extraction Approach and an Empirical Study,,
Do# ifdefs influence the occurrence of vulnerabilities? an empirical study of the linux kernel,Forward ,not-relevant,,Where Do Configuration Constraints Stem From? An Extraction Approach and an Empirical Study,,
A qualitative study of application-level caching,Forward ,not-relevant,,Where Do Configuration Constraints Stem From? An Extraction Approach and an Empirical Study,,
Navigating the maze: the impact of configurability in bioinformatics software,Forward ,not-relevant,,Where Do Configuration Constraints Stem From? An Extraction Approach and an Empirical Study,,
Quantifying the variability mismatch between problem and solution space,Forward ,not-relevant,,Where Do Configuration Constraints Stem From? An Extraction Approach and an Empirical Study,,
Kmax: Finding all configurations of kbuild makefiles statically,Forward ,not-relevant,,Where Do Configuration Constraints Stem From? An Extraction Approach and an Empirical Study,,
Recommending Faulty Configurations for Interacting Systems Under Test Using Multi-objective Search,Forward ,relevant,,Where Do Configuration Constraints Stem From? An Extraction Approach and an Empirical Study,,
Mining cross product line rules with multi-objective search and machine learning,Forward ,relevant,,Where Do Configuration Constraints Stem From? An Extraction Approach and an Empirical Study,,
Composing annotations without regret? Practical experiences using FeatureC,Forward ,not-relevant,,Where Do Configuration Constraints Stem From? An Extraction Approach and an Empirical Study,,
An empirical study of real-world variability bugs detected by variability-oblivious tools,Forward ,not-relevant,,Where Do Configuration Constraints Stem From? An Extraction Approach and an Empirical Study,,
An empirical study of configuration mismatches in linux,Forward ,relevant,,Where Do Configuration Constraints Stem From? An Extraction Approach and an Empirical Study,,
A calculus for variational programming,Forward ,not-relevant,,Where Do Configuration Constraints Stem From? An Extraction Approach and an Empirical Study,,
Mining feature revisions in highly-configurable software systems,Forward ,not-relevant,,Where Do Configuration Constraints Stem From? An Extraction Approach and an Empirical Study,,
CoMID: Context-based multiinvariant detection for monitoring cyber-physical software,Forward ,not-relevant,,Where Do Configuration Constraints Stem From? An Extraction Approach and an Empirical Study,,
KernelHaven: an experimentation workbench for analyzing software product lines,Forward ,not-relevant,,Where Do Configuration Constraints Stem From? An Extraction Approach and an Empirical Study,,
On language levels for feature modeling notations,Forward ,not-relevant,,Where Do Configuration Constraints Stem From? An Extraction Approach and an Empirical Study,,
KernelHaven: An open infrastructure for product line analysis,Forward ,not-relevant,,Where Do Configuration Constraints Stem From? An Extraction Approach and an Empirical Study,,
How explicit feature traces did not impact developers' memory,Forward ,not-relevant,,Where Do Configuration Constraints Stem From? An Extraction Approach and an Empirical Study,,
Covert and phantom features in annotations: Do they impact variability analysis?,Forward ,not-relevant,,Where Do Configuration Constraints Stem From? An Extraction Approach and an Empirical Study,,
Learning from thousands of build failures of linux kernel configurations,Forward ,not-relevant,,Where Do Configuration Constraints Stem From? An Extraction Approach and an Empirical Study,,
Learning-based performance specialization of configurable systems,Forward ,not-relevant,,Where Do Configuration Constraints Stem From? An Extraction Approach and an Empirical Study,,
An empirical investigation of organic software product lines,Forward ,not-relevant,,Where Do Configuration Constraints Stem From? An Extraction Approach and an Empirical Study,,
Don't Worry About it: Managing Variability On-The-Fly,Forward ,relevant,,Where Do Configuration Constraints Stem From? An Extraction Approach and an Empirical Study,,
Incremental software product line verification-A performance analysis with dead variable code,Forward ,not-relevant,,Where Do Configuration Constraints Stem From? An Extraction Approach and an Empirical Study,,
ConfigFix: interactive configuration conflict resolution for the Linux kernel,Forward ,not-relevant,,Where Do Configuration Constraints Stem From? An Extraction Approach and an Empirical Study,,
Using multi-objective search and machine learning to infer rules constraining product configurations,Forward ,relevant,,Where Do Configuration Constraints Stem From? An Extraction Approach and an Empirical Study,,
A framework for automated multi-stage and multi-step product configuration of cyber-physical systems,Forward ,not-relevant,,Where Do Configuration Constraints Stem From? An Extraction Approach and an Empirical Study,"cyber physical systems, configuration language",
To preserve or not to preserve invalid solutions in search-based software engineering: a case study in software product lines,Forward ,not-relevant,,Where Do Configuration Constraints Stem From? An Extraction Approach and an Empirical Study,,
We're Not Gonna Break It! Consistency-Preserving Operators for Efficient Product Line Configuration,Forward ,not-relevant,,Where Do Configuration Constraints Stem From? An Extraction Approach and an Empirical Study,,
Finding broken Linux configuration specifications by statically analyzing the Kconfig language,Forward ,not-relevant,,Where Do Configuration Constraints Stem From? An Extraction Approach and an Empirical Study,configuration language,
Feature similarity: A method to detect unwanted feature interactions earlier in software product lines,Forward ,not accessible,,Where Do Configuration Constraints Stem From? An Extraction Approach and an Empirical Study,,
Enabling efficient automated configuration generation and management,Forward ,not-relevant,,Where Do Configuration Constraints Stem From? An Extraction Approach and an Empirical Study,,
On compression of encrypted video,Forward ,not-relevant,,Where Do Configuration Constraints Stem From? An Extraction Approach and an Empirical Study,,
Answering the call of the wild? thoughts on the elusive quest for ecological validity in variability modeling,Forward ,not-relevant,,Where Do Configuration Constraints Stem From? An Extraction Approach and an Empirical Study,,
Reverse engineering variability in an industrial product line: observations and lessons learned,Forward ,not-relevant,,Where Do Configuration Constraints Stem From? An Extraction Approach and an Empirical Study,,
Scaling up the fitness function for reverse engineering feature models,Forward ,not-relevant,,Where Do Configuration Constraints Stem From? An Extraction Approach and an Empirical Study,,
"Demonstration of a Toolchain for Feature Extraction, Analysis and Visualization on an Industrial Case Study",Forward ,not-relevant,,Where Do Configuration Constraints Stem From? An Extraction Approach and an Empirical Study,,
Localizing configurations in highly-configurable systems,Forward ,not-relevant,,Where Do Configuration Constraints Stem From? An Extraction Approach and an Empirical Study,,
Leveraging feature similarity for earlier detection of unwanted feature interactions in evolving software product lines,Forward ,relevant,,Where Do Configuration Constraints Stem From? An Extraction Approach and an Empirical Study,,
Evolving System Families in Space and Time,Forward ,not-relevant,,Where Do Configuration Constraints Stem From? An Extraction Approach and an Empirical Study,,
Tseitin or not Tseitin? The Impact of CNF Transformations on Feature-Model Analyses,Forward ,not-relevant,,Where Do Configuration Constraints Stem From? An Extraction Approach and an Empirical Study,,
Clock-frequency assignment for multiple clock domain systems-on-a-chip,Forward ,not-relevant,,Where Do Configuration Constraints Stem From? An Extraction Approach and an Empirical Study,,
Dip-coating of Superhydrophobic Surface on Irregular Substrates for Dropwise Condensation,Forward ,not-relevant,,Where Do Configuration Constraints Stem From? An Extraction Approach and an Empirical Study,,
SPL-XFactor: a framework for reverse engineering feature models,Forward ,not-relevant,,Where Do Configuration Constraints Stem From? An Extraction Approach and an Empirical Study,,
Projectional editing of software product lines–The PEoPL approach,Forward ,not-relevant,,Where Do Configuration Constraints Stem From? An Extraction Approach and an Empirical Study,,
"Feature-Oriented Defect Prediction: Scenarios, Metrics, and Classifiers",Forward ,not-relevant,,Where Do Configuration Constraints Stem From? An Extraction Approach and an Empirical Study,,
Feature subset selection for learning huge configuration spaces: the case of linux kernel size,Forward ,not-relevant,,Where Do Configuration Constraints Stem From? An Extraction Approach and an Empirical Study,,
Improving Software Engineering Research Through Experimentation Workbenches,Forward ,not-relevant,,Where Do Configuration Constraints Stem From? An Extraction Approach and an Empirical Study,,
Consistent View-Based Management of Variability in Space and Time,Forward ,not-relevant,,Where Do Configuration Constraints Stem From? An Extraction Approach and an Empirical Study,,
Machine Learning for Performance Modelling on Colossal Software Configuration Spaces,Forward ,not-relevant,,Where Do Configuration Constraints Stem From? An Extraction Approach and an Empirical Study,,
Facilitating Feature-Oriented Quality Assurance in Low-Maturity Variant-Rich Systems,Forward ,not-relevant,,Where Do Configuration Constraints Stem From? An Extraction Approach and an Empirical Study,,
Improving Post-Deployment Configuration of Cyber-Physical Systems Using Machine Learning and Multi-Objective Search,Forward ,not-relevant,,Where Do Configuration Constraints Stem From? An Extraction Approach and an Empirical Study,cyber physical systems,
An approach to safely evolve preprocessor-based C program families,Forward ,not-relevant,,Where Do Configuration Constraints Stem From? An Extraction Approach and an Empirical Study,,
Learning feature interactions with and without specifications,Forward ,relevant,,Where Do Configuration Constraints Stem From? An Extraction Approach and an Empirical Study,,
Interpretability of configurable software in the biosciences,Forward ,not-relevant,,Where Do Configuration Constraints Stem From? An Extraction Approach and an Empirical Study,,
Understanding Variability-Aware Analysis in Low-Maturity Variant-Rich Systems,Forward ,not-relevant,,Where Do Configuration Constraints Stem From? An Extraction Approach and an Empirical Study,,
Software unbundling: Challenges and perspectives,Forward ,not-relevant,,Where Do Configuration Constraints Stem From? An Extraction Approach and an Empirical Study,,
Comparing the Intensity of Variability Changes in Software Product Line Evolution,Forward ,not-relevant,,Where Do Configuration Constraints Stem From? An Extraction Approach and an Empirical Study,,
Variability models in large-scale systems: A study and a reverse-engineering technique,Forward ,relevant,,Where Do Configuration Constraints Stem From? An Extraction Approach and an Empirical Study,,
The pathway to customised product solutions,Forward ,relevant,,Where Do Configuration Constraints Stem From? An Extraction Approach and an Empirical Study,,
Employing Multi-Objective Search and Machine Learning to Mine Cross Product Line Rules: A Technical Report,Forward ,relevant,,Where Do Configuration Constraints Stem From? An Extraction Approach and an Empirical Study,,
Location of Features as Model Fragments and their Co-Evolution,Forward ,not-relevant,,Where Do Configuration Constraints Stem From? An Extraction Approach and an Empirical Study,,
Constructing feature model by identifying variability-aware modules,Forward ,not-relevant,,Where Do Configuration Constraints Stem From? An Extraction Approach and an Empirical Study,,
On extracting feature models from product descriptions,Backward,not-relevant,,Where Do Configuration Constraints Stem From? An Extraction Approach and an Empirical Study,,
Identifying inactive code in product lines with configuration-aware system dependence graphs,Backward,not-relevant,,Where Do Configuration Constraints Stem From? An Extraction Approach and an Empirical Study,,
Handling preprocessorconditioned declarations,Backward,relevant,,Where Do Configuration Constraints Stem From? An Extraction Approach and an Empirical Study,,
Preprocessor conditional removal by simple partial evaluation,Backward,not-relevant,,Where Do Configuration Constraints Stem From? An Extraction Approach and an Empirical Study,,
Transitioning legacy assets to a product line architecture,Backward,not-relevant,,Where Do Configuration Constraints Stem From? An Extraction Approach and an Empirical Study,,
Automated analysis of feature models 20 years later: A literature review,Backward,not-relevant,,Where Do Configuration Constraints Stem From? An Extraction Approach and an Empirical Study,,
Three cases of feature-based variability modeling in industry,Backward,not-relevant,,Where Do Configuration Constraints Stem From? An Extraction Approach and an Empirical Study,,
A survey of variability modeling in industrial practice,Backward,not-relevant,,Where Do Configuration Constraints Stem From? An Extraction Approach and an Empirical Study,,
Formal semantics of the CDL language,Backward,not-relevant,,Where Do Configuration Constraints Stem From? An Extraction Approach and an Empirical Study,,
Featureto-Code mapping in two large product lines,Backward,not-relevant,,Where Do Configuration Constraints Stem From? An Extraction Approach and an Empirical Study,,
A study of variability models and languages in the systems software domain,Backward,relevant,,Where Do Configuration Constraints Stem From? An Extraction Approach and an Empirical Study,,
Variability modeling in the real: A perspective from the operating systems domain,Backward,not-relevant,,Where Do Configuration Constraints Stem From? An Extraction Approach and an Empirical Study,,
Mining existing assets for software product lines,Backward,not-relevant,,Where Do Configuration Constraints Stem From? An Extraction Approach and an Empirical Study,,
Spllift-Statically analyzing software product lines in minutes instead of years,Backward,not-relevant,,Where Do Configuration Constraints Stem From? An Extraction Approach and an Empirical Study,,
Intraprocedural dataflow analysis for software product lines,Backward,not-relevant,,Where Do Configuration Constraints Stem From? An Extraction Approach and an Empirical Study,,
Verifying feature-based model templates against well-formedness OCL constraints,Backward,not-relevant,,Where Do Configuration Constraints Stem From? An Extraction Approach and an Empirical Study,configuration language,
Feature model extraction from large collections of informal product descriptions,Backward,relevant,,Where Do Configuration Constraints Stem From? An Extraction Approach and an Empirical Study,,
Efficient reuse of domain-specific test knowledge: An industrial case in the smart card domain,Backward,not-relevant,,Where Do Configuration Constraints Stem From? An Extraction Approach and an Empirical Study,,
The DOPLER meta-tool for decision-oriented variability modeling: A multiple case study,Backward,not-relevant,,Where Do Configuration Constraints Stem From? An Extraction Approach and an Empirical Study,,
An empirical analysis of C preprocessor use,Backward,not-relevant,,Where Do Configuration Constraints Stem From? An Extraction Approach and an Empirical Study,,
Verifying architectural design rules of the flight software product line,Backward,not-relevant,,Where Do Configuration Constraints Stem From? An Extraction Approach and an Empirical Study,,
Supporting domain analysis through mining and recommending features from online product listings,Backward,not-relevant,,Where Do Configuration Constraints Stem From? An Extraction Approach and an Empirical Study,,
Preprocessor-based variability in opensource and industrial software systems,Backward,not-relevant,,Where Do Configuration Constraints Stem From? An Extraction Approach and an Empirical Study,,
Running a software product lineStanding still is going backwards,Backward,not-relevant,,Where Do Configuration Constraints Stem From? An Extraction Approach and an Empirical Study,,
Feature-oriented domain analysis (FODA) feasibility study,Backward,not-relevant,,Where Do Configuration Constraints Stem From? An Extraction Approach and an Empirical Study,,
Type checking annotation-based product lines,Backward,relevant,,Where Do Configuration Constraints Stem From? An Extraction Approach and an Empirical Study,,
Variability-aware parsing in the presence of lexical macros and conditional compilation,Backward,not-relevant,,Where Do Configuration Constraints Stem From? An Extraction Approach and an Empirical Study,,
A variability-aware module system,Backward,relevant,,Where Do Configuration Constraints Stem From? An Extraction Approach and an Empirical Study,,
Validating consistency between a feature model and its implementation,Backward,relevant,,Where Do Configuration Constraints Stem From? An Extraction Approach and an Empirical Study,,
An analysis of the variability in forty preprocessor-based software product lines,Backward,not-relevant,,Where Do Configuration Constraints Stem From? An Extraction Approach and an Empirical Study,,
Scalable analysis of variable software,Backward,not-relevant,,Where Do Configuration Constraints Stem From? An Extraction Approach and an Empirical Study,,
Evolution of the Linux kernel variability model,Backward,relevant,,Where Do Configuration Constraints Stem From? An Extraction Approach and an Empirical Study,,
"Disambiguating the documentation of variability in software product lines: A separation of concerns, formalization and automated analysis",Backward,not-relevant,,Where Do Configuration Constraints Stem From? An Extraction Approach and an Empirical Study,,
Mining Kbuild to detect variability anomalies in Linux,Backward,relevant,,Where Do Configuration Constraints Stem From? An Extraction Approach and an Empirical Study,,
The Linux kernel: A case study of build system variability,Backward,relevant,,Where Do Configuration Constraints Stem From? An Extraction Approach and an Empirical Study,,
Exploring variability-aware execution for testing plugin-based web applications,Backward,not-relevant,,Where Do Configuration Constraints Stem From? An Extraction Approach and an Empirical Study,,
A survey of combinatorial testing,Backward,not-relevant,,Where Do Configuration Constraints Stem From? An Extraction Approach and an Empirical Study,,
Parsing C/C++ code without pre-processing,Backward,not-relevant,,Where Do Configuration Constraints Stem From? An Extraction Approach and an Empirical Study,,
Coevolution of variability models and related artifacts: A case study from the Linux kernel,Backward,not-relevant,,Where Do Configuration Constraints Stem From? An Extraction Approach and an Empirical Study,,
A study of non-Boolean constraints in variability models of an embedded operating system,Backward,not-relevant,,Where Do Configuration Constraints Stem From? An Extraction Approach and an Empirical Study,configuration language,
Experiences developing and maintaining software in a multi-platform environment,Backward,not-relevant,,Where Do Configuration Constraints Stem From? An Extraction Approach and an Empirical Study,,
Using symbolic evaluation to understand behavior in configurable software systems,Backward,relevant,,Where Do Configuration Constraints Stem From? An Extraction Approach and an Empirical Study,,
Guidelines for conducting and reporting case study research in software engineering,Backward,not-relevant,,Where Do Configuration Constraints Stem From? An Extraction Approach and an Empirical Study,,
The variability model of the Linux kernel,Backward,relevant,,Where Do Configuration Constraints Stem From? An Extraction Approach and an Empirical Study,,
Reverse engineering feature models,Backward,not-relevant,,Where Do Configuration Constraints Stem From? An Extraction Approach and an Empirical Study,,
Evolutionary introduction of software product lines,Backward,not-relevant,,Where Do Configuration Constraints Stem From? An Extraction Approach and an Empirical Study,,
Is the Linux kernel a software product line?,Backward,not-relevant,,Where Do Configuration Constraints Stem From? An Extraction Approach and an Empirical Study,,
Efficient extraction and analysis of preprocessor-based variability,Backward,relevant,,Where Do Configuration Constraints Stem From? An Extraction Approach and an Empirical Study,,
MAP—Mining architectures for product line evaluations,Backward,not-relevant,,Where Do Configuration Constraints Stem From? An Extraction Approach and an Empirical Study,,
Build code analysis with symbolic evaluation,Backward,not-relevant,,Where Do Configuration Constraints Stem From? An Extraction Approach and an Empirical Study,,
