Snowballing: Backward/Forward,Method,Annotator 1,Annotator 2,Origin Paper,,
Bringing Together Configuration Research: Towards a Common Ground,Forward,not-relevant,,Understanding configuration dependencies of file systems,,
On the Reproducibility of Bugs in File-System Aware Storage Applications,Forward,relevant,,Understanding configuration dependencies of file systems,,
"BenchCouncil Transactions on Benchmarks, Standards and Evaluations",Backward,not-relevant,,Understanding configuration dependencies of file systems,,
A Study of Failure Recovery and Logging of High-Performance Parallel File Systems,Backward,not-relevant,,Understanding configuration dependencies of file systems,,
Fingerprinting the Checker Policies of Parallel File Systems,Backward,not-relevant,,Understanding configuration dependencies of file systems,,
On Failure Diagnosis of the Storage Stack,Backward,not-relevant,,Understanding configuration dependencies of file systems,,
PFault: A General Framework for Analyzing the Reliability of High-Performance Parallel File Systems,Backward,not-relevant,,Understanding configuration dependencies of file systems,,
A study of persistent memory bugs in the Linux kernel,Backward,not-relevant,,Understanding configuration dependencies of file systems,,
A Generic Framework for Testing Parallel File Systems,Backward,not-relevant,,Understanding configuration dependencies of file systems,,
Towards Robust File System Checkers,Backward,not-relevant,,Understanding configuration dependencies of file systems,,
Benchmarking for observability: The case of diagnosing storage failures,Backward,not-relevant,,Understanding configuration dependencies of file systems,,
Understanding the Fault Resilience of File System Checkers,Backward,not-relevant,,Understanding configuration dependencies of file systems,,
SAIBench: Benchmarking AI for Science,Backward,not-relevant,,Understanding configuration dependencies of file systems,,
Three Laws of Technology Rise or Fall,Backward,not-relevant,,Understanding configuration dependencies of file systems,,
Preparing for the Future - Rethinking Proxy Apps,Backward,not-relevant,,Understanding configuration dependencies of file systems,,
Reliability Analysis of SSDs Under Power Fault,Backward,not-relevant,,Understanding configuration dependencies of file systems,,
Pinpointing Crash-Consistency Bugs in the HPC I/O Stack: A Cross-layer Approach,Backward,not-relevant,,Understanding configuration dependencies of file systems,,
Finding Bugs in File Systems with an Extensible Fuzzing Framework,Backward,not-relevant,,Understanding configuration dependencies of file systems,,
Understanding and Finding Crash-Consistency Bugs in Parallel File Systems,Backward,not-relevant,,Understanding configuration dependencies of file systems,,
PROV-IO: An I/O-Centric Provenance Framework for Scientific Data on HPC Systems,Backward,not-relevant,,Understanding configuration dependencies of file systems,,
Torturing Databases for Fun and Profit,Backward,not-relevant,,Understanding configuration dependencies of file systems,,
Finding semantic bugs in file systems with an extensible fuzzing framework,Backward,not-relevant,,Understanding configuration dependencies of file systems,,
Understanding the robustness of SSDS under power fault,Backward,not-relevant,,Understanding configuration dependencies of file systems,,
Safe Management of Software Configuration,Backward,not-relevant,,Understanding configuration dependencies of file systems,,
A Performance Study of Lustre File System Checker: Bottlenecks and Potentials,Backward,not-relevant,,Understanding configuration dependencies of file systems,,
Understanding SSD Reliability in Large-Scale Cloud Systems,Backward,not-relevant,,Understanding configuration dependencies of file systems,,
Evaluating File System Reliability on Solid State Drives,Backward,not-relevant,,Understanding configuration dependencies of file systems,,
On Fault Resilience of File System Checkers,Backward,not-relevant,,Understanding configuration dependencies of file systems,,
The Reliability of Modern File Systems in the face of SSD Errors,Backward,not-relevant,,Understanding configuration dependencies of file systems,,
Fault Tolerance Performance Evaluation of Large-Scale Distributed Storage Systems HDFS and Ceph Case Study,Backward,not-relevant,,Understanding configuration dependencies of file systems,,
Automated Implementation of Windows-related Security-Configuration Guides,Backward,not-relevant,,Understanding configuration dependencies of file systems,,
Model-Checking Support for File System Development,Backward,not-relevant,,Understanding configuration dependencies of file systems,,
Experiencing ProvLake to Manage the Data Lineage of AI Workflows,Backward,not-relevant,,Understanding configuration dependencies of file systems,,
H5Prov: I/O Performance Analysis of Science Applications Using HDF5 File-level Provenance,Backward,not-relevant,,Understanding configuration dependencies of file systems,,
Provenance in Collaborative in Silico Scientific Research,Backward,not-relevant,,Understanding configuration dependencies of file systems,,
Verifying IO Synchronization from MPI Traces,Backward,not-relevant,,Understanding configuration dependencies of file systems,,
Call for establishing benchmark science and engineering,Backward,not-relevant,,Understanding configuration dependencies of file systems,,
You can't debug what you can't see: Expanding observability with the OmniTable,Backward,not-relevant,,Understanding configuration dependencies of file systems,,
Provenance in Collaborative in Silico Scientific Research: a Survey,Backward,not-relevant,,Understanding configuration dependencies of file systems,,
Specifying and checking file system crashconsistency models,Backward,not-relevant,,Understanding configuration dependencies of file systems,,
Carver: Finding Important Parameters for Storage System Tuning,Backward,not-relevant,,Understanding configuration dependencies of file systems,,
Model Checking and the State Explosion Problem,Backward,not-relevant,,Understanding configuration dependencies of file systems,,
CONFU: Configuration Fuzzing Testing Framework for Software Vulnerability Detection,Backward,relevant,,Understanding configuration dependencies of file systems,,
Verifying File System Consistency at Runtime,Backward,not-relevant,,Understanding configuration dependencies of file systems,,
Redundancy Does Not Imply Fault Tolerance: Analysis of Distributed Storage Reactions to Single Errors and Corruptions,Backward,not-relevant,,Understanding configuration dependencies of file systems,,
ConfErr: A tool for assessing resilience to human configuration errors,Backward,relevant,,Understanding configuration dependencies of file systems,,
A Study of Linux File System Evolution,Backward,not-relevant,,Understanding configuration dependencies of file systems,,
Learning from Mistakes: A Comprehensive Study on Real World Concurrency Bug Characteristics,Backward,not-relevant,,Understanding configuration dependencies of file systems,,
DR. Checker: A Soundy Analysis for Linux Kernel Drivers,Backward,not-relevant,,Understanding configuration dependencies of file systems,,
Cross-Checking Semantic Correctness: The Case of Finding File System Bugs,Backward,not-relevant,,Understanding configuration dependencies of file systems,,
IRON File Systems,Backward,not-relevant,,Understanding configuration dependencies of file systems,,
Static extraction of program configuration options,Backward,relevant,,Understanding configuration dependencies of file systems,,
Spiffy: Enabling File-System Aware Storage Applications,Backward,relevant,,Understanding configuration dependencies of file systems,,
Holistic Configuration Management at Facebook,Backward,relevant,,Understanding configuration dependencies of file systems,,
An HCI View of Configuration Problems,Backward,relevant,,Understanding configuration dependencies of file systems,,
An Evolutionary Study of Configuration Design and Implementation in Cloud Systems,Forward,relevant,,Understanding and discovering software configuration dependencies in cloud and datacenter systems,,
Static detection of silent misconfigurations with deep interaction analysis,Forward,relevant,,Understanding and discovering software configuration dependencies in cloud and datacenter systems,,
Test-case prioritization for configuration testing,Forward,not-relevant,,Understanding and discovering software configuration dependencies in cloud and datacenter systems,,
ConfInLog: Leveraging Software Logs to Infer Configuration Constraints,Forward,relevant,,Understanding and discovering software configuration dependencies in cloud and datacenter systems,,
Multi-intention-aware configuration selection for performance tuning,Forward,not-relevant,,Understanding and discovering software configuration dependencies in cloud and datacenter systems,,
Forensic analysis of configuration-based attacks,Forward,not-relevant,,Understanding and discovering software configuration dependencies in cloud and datacenter systems,,
Deep Understanding of Runtime Configuration Intention,Forward,not-relevant,,Understanding and discovering software configuration dependencies in cloud and datacenter systems,,
Characterizing and Detecting Configuration Compatibility Issues in Android Apps,Forward,relevant,,Understanding and discovering software configuration dependencies in cloud and datacenter systems,,
Finding heterogeneous-unsafe configuration parameters in cloud systems,Forward,relevant,,Understanding and discovering software configuration dependencies in cloud and datacenter systems,,
A Survey on Tackling Software Configuration Faults,Forward,not-relevant,,Understanding and discovering software configuration dependencies in cloud and datacenter systems,,
Automatic Inference of Computing Environments,Forward,not-relevant,,Understanding and discovering software configuration dependencies in cloud and datacenter systems,,
Detecting Access Control Misconfigurations with Change Validation,Forward,not-relevant,,Understanding and discovering software configuration dependencies in cloud and datacenter systems,,
Mitigating Distributed Configuration Errors in Cloud Systems,Forward,not-relevant,,Understanding and discovering software configuration dependencies in cloud and datacenter systems,,
Discovering feature flag interdependencies in Microsoft office,Forward,relevant,,Understanding and discovering software configuration dependencies in cloud and datacenter systems,,
PracExtractor: Extracting Configuration Good Practices from Manuals to Detect Server Misconfigurations,Backward,relevant,,Understanding and discovering software configuration dependencies in cloud and datacenter systems,,
Testing Configuration Changes in Context to Prevent Production Failures,Backward,relevant,,Understanding and discovering software configuration dependencies in cloud and datacenter systems,,
"Software Configuration Engineering in Practice Interviews, Survey, and Systematic Literature Review",Backward,relevant,,Understanding and discovering software configuration dependencies in cloud and datacenter systems,,
ConfEx: A Framework for Automating Text-based Software Configuration Analysis in the Cloud,Backward,relevant,,Understanding and discovering software configuration dependencies in cloud and datacenter systems,,
Statically inferring performance properties of software configurations,Backward,relevant,,Understanding and discovering software configuration dependencies in cloud and datacenter systems,,
Automated Reasoning and Detection of Specious Configuration in Large Systems with Symbolic Execution,Backward,relevant,,Understanding and discovering software configuration dependencies in cloud and datacenter systems,,
What should your run-time configuration framework do to help developers?,Backward,relevant,,Understanding and discovering software configuration dependencies in cloud and datacenter systems,,
Configuration Testing: Testing Configuration Values as Code and with Code.,Backward,relevant,,Understanding and discovering software configuration dependencies in cloud and datacenter systems,,
Towards Continuous Access Control Validation and Forensics,Backward,not-relevant,,Understanding and discovering software configuration dependencies in cloud and datacenter systems,,
Software Configuration Diagnosis - A Survey of Existing Methods and Open Challenges,Backward,relevant,,Understanding and discovering software configuration dependencies in cloud and datacenter systems,,
Mining Container Image Repositories for Software Configuration and Beyond,Backward,relevant,,Understanding and discovering software configuration dependencies in cloud and datacenter systems,,
MisconfDoctor: Diagnosing Misconfiguration via Log-Based Configuration Testing,Backward,relevant,,Understanding and discovering software configuration dependencies in cloud and datacenter systems,,
"Usable declarative configuration specification and validation for applications, systems, and cloud",Backward,not-relevant,,Understanding and discovering software configuration dependencies in cloud and datacenter systems,,
Early Detection of Configuration Errors to Reduce Failure Damage,Backward,relevant,,Understanding and discovering software configuration dependencies in cloud and datacenter systems,,
Determine Configuration Entry Correlations for Web Application Systems,Backward,relevant,,Understanding and discovering software configuration dependencies in cloud and datacenter systems,,
Getting Back Up: Understanding How Enterprise Data Backups Fail,Backward,not-relevant,,Understanding and discovering software configuration dependencies in cloud and datacenter systems,,
Probabilistic Automated Language Learning for Configuration Files,Backward,relevant,,Understanding and discovering software configuration dependencies in cloud and datacenter systems,,
ORPLocator: Identifying Read Points of Configuration Options via Static Analysis,Backward,not-relevant,,Understanding and discovering software configuration dependencies in cloud and datacenter systems,,
ConfMapper: Automated Variable Finding for Configuration Items in Source Code,Backward,not-relevant,,Understanding and discovering software configuration dependencies in cloud and datacenter systems,,
"Hey, you have given me too many knobs!: understanding and dealing with over-designed configuration in system software",Backward,relevant,,Understanding and discovering software configuration dependencies in cloud and datacenter systems,,
On Problematic Robotic Thresholds,Backward,not-relevant,,Understanding and discovering software configuration dependencies in cloud and datacenter systems,,
ConfValley: a systematic configuration validation framework for cloud services,Backward,relevant,,Understanding and discovering software configuration dependencies in cloud and datacenter systems,,
Practical and accurate pinpointing of configuration errors using static analysis,Backward,not-relevant,,Understanding and discovering software configuration dependencies in cloud and datacenter systems,,
Proactive detection of inadequate diagnostic messages for software configuration errors,Backward,relevant,,Understanding and discovering software configuration dependencies in cloud and datacenter systems,,
PrefFinder: getting the right preference in configurable software systems,Backward,not-relevant,,Understanding and discovering software configuration dependencies in cloud and datacenter systems,,
Automating Configuration Troubleshooting with Dynamic Information Flow Analysis,Backward,relevant,,Understanding and discovering software configuration dependencies in cloud and datacenter systems,,
X-ray: Automating Root-Cause Diagnosis of Performance Anomalies in Production Software,Backward,not-relevant,,Understanding and discovering software configuration dependencies in cloud and datacenter systems,,
The Datacenter as a Computer: An Introduction to the Design of Warehouse-scale Machines,Backward,not-relevant,,Understanding and discovering software configuration dependencies in cloud and datacenter systems,,
Users Beware: Preference Inconsistencies Ahead,Backward,not-relevant,,Understanding and discovering software configuration dependencies in cloud and datacenter systems,,
Demystifying Configuration Challenges and Trade-Offs in Network-based ISP Services,Backward,not-relevant,,Understanding and discovering software configuration dependencies in cloud and datacenter systems,,
Constructing Interaction Test Suites for Highly-Configurable Systems in the Presence of Constraints: A Greedy Approach,Backward,relevant,,Understanding and discovering software configuration dependencies in cloud and datacenter systems,,
Feedback Driven Adaptive Combinatorial Testing,Backward,relevant,,Understanding and discovering software configuration dependencies in cloud and datacenter systems,,
Detection of Logical Coupling Based on Product Release History,Backward,not-relevant,,Understanding and discovering software configuration dependencies in cloud and datacenter systems,,
Why Does the Cloud Stop Computing? Lessons from Hundreds of Service Outages,Backward,relevant,,Understanding and discovering software configuration dependencies in cloud and datacenter systems,,
A User Survey of Configuration Challenges in Linux and eCos,Backward,relevant,,Understanding and discovering software configuration dependencies in cloud and datacenter systems,,
Are Disks the Dominant Contributor for Storage Failures,Backward,not-relevant,,Understanding and discovering software configuration dependencies in cloud and datacenter systems,,
Configurations Everywhere: Implications for Testing and Debugging in Practice,Backward,not-relevant,,Understanding and discovering software configuration dependencies in cloud and datacenter systems,,
Set the Configuration for the Heart of the OS: On the Practicality of Operating System Kernel Debloating,Backward,relevant,,Understanding and discovering software configuration dependencies in cloud and datacenter systems,,
Tracking Load-time Configuration Options,Backward,relevant,,Understanding and discovering software configuration dependencies in cloud and datacenter systems,,
Fail at Scale: Reliability in the Face of Rapid Change,Backward,not-relevant,,Understanding and discovering software configuration dependencies in cloud and datacenter systems,,
iGen: Dynamic Interaction Inference for Configurable Software,Backward,relevant,,Understanding and discovering software configuration dependencies in cloud and datacenter systems,,
Configuration Aware Prioritization Techniques in Regression Testing,Backward,not-relevant,,Understanding and discovering software configuration dependencies in cloud and datacenter systems,,
Configuration-Aware Regression Testing: An Empirical Study of Sampling and Prioritization,Backward,not-relevant,,Understanding and discovering software configuration dependencies in cloud and datacenter systems,,
Impact Analysis of Configuration Changes for Test Case Selection,Backward,not-relevant,,Understanding and discovering software configuration dependencies in cloud and datacenter systems,,
Precomputing Possible Configuration Error Diagnosis,Backward,relevant,,Understanding and discovering software configuration dependencies in cloud and datacenter systems,,
How Hadoop Clusters Break,Backward,relevant,,Understanding and discovering software configuration dependencies in cloud and datacenter systems,,
Using Symbolic Evaluation to Understand Behavior in Configurable Software Systems,Backward,not-relevant,,Understanding and discovering software configuration dependencies in cloud and datacenter systems,,
On Cross-stack Configuration Errors,Backward,relevant,,Understanding and discovering software configuration dependencies in cloud and datacenter systems,,
All You Ever Wanted to Know about Dynamic Taint Analysis and Forward Symbolic Execution (but Might Have Been Afraid to Ask),Backward,not-relevant,,Understanding and discovering software configuration dependencies in cloud and datacenter systems,,
iTree: Efficiently Discovering High-Coverage Configuration Using Interaction Trees,Backward,relevant,,Understanding and discovering software configuration dependencies in cloud and datacenter systems,,
Balancing Soundness and Efficiency for Practical Testing of Configurable Systems,Backward,relevant,,Understanding and discovering software configuration dependencies in cloud and datacenter systems,,
Reducing Field Failures in System Configurable Software: Cost-Based Prioritization,Backward,not-relevant,,Understanding and discovering software configuration dependencies in cloud and datacenter systems,,
Automatic Misconfiguration Troubleshooting with PeerPressure,Backward,not-relevant,,Understanding and discovering software configuration dependencies in cloud and datacenter systems,,
"STRIDER: A Black-box, State-based Approach to Change and Configuration Management and Support",Backward,not-relevant,,Understanding and discovering software configuration dependencies in cloud and datacenter systems,,
Mining Container Image Repositories for Software Configurations and Beyond,Backward,not-relevant,,Understanding and discovering software configuration dependencies in cloud and datacenter systems,,
How Do System Administrators Resolve Access-Denied Issues in the Real World?,Backward,not-relevant,,Understanding and discovering software configuration dependencies in cloud and datacenter systems,,
Be Conservative: Enhancing Failure Diagnosis with Proactive Logging,Backward,not-relevant,,Understanding and discovering software configuration dependencies in cloud and datacenter systems,,
Simple Testing Can Prevent Most Critical Failures: An Analysis of Production Failures in Distributed Data-intensive Systems,Backward,not-relevant,,Understanding and discovering software configuration dependencies in cloud and datacenter systems,,
Natural Language is a Programming Language: Applying Natural Language Processing to Software Development,Forward,not-relevant,,Determining configuration parameter dependencies via analysis of configuration data from multi-tiered enterprise applications,,
ConfSeer: Leveraging Customer Support Knowledge Bases for Automated Misconfiguration Detection,Forward,relevant,,Determining configuration parameter dependencies via analysis of configuration data from multi-tiered enterprise applications,,
Which configuration option should I change?,Forward,relevant,,Determining configuration parameter dependencies via analysis of configuration data from multi-tiered enterprise applications,,
ICSE: G: Fighting Software Configuration Errors with Combined Static and Dynamic Program Analyses,Forward,relevant,,Determining configuration parameter dependencies via analysis of configuration data from multi-tiered enterprise applications,,
Context-based Online Configuration-Error Detection,Forward,not-relevant,,Determining configuration parameter dependencies via analysis of configuration data from multi-tiered enterprise applications,,
Methods and systems for migrating networked systems across administrative domains,Forward,not-relevant,,Determining configuration parameter dependencies via analysis of configuration data from multi-tiered enterprise applications,,
Methods and systems for discovering configuration data,Forward,not-relevant,,Determining configuration parameter dependencies via analysis of configuration data from multi-tiered enterprise applications,,
Enabling on-the-fly business process composition through an event-based approach,Forward,not-relevant,,Determining configuration parameter dependencies via analysis of configuration data from multi-tiered enterprise applications,,
Misconfiguration detection for cloud datacenters using decision tree analysis,Forward,relevant,,Determining configuration parameter dependencies via analysis of configuration data from multi-tiered enterprise applications,,
Autonomic computing in the first decade: trends and direction,Forward,not-relevant,,Determining configuration parameter dependencies via analysis of configuration data from multi-tiered enterprise applications,,
Software Configuration Diagnosis-A Survey of Existing Methods and Open Challenges,Forward,relevant,,Determining configuration parameter dependencies via analysis of configuration data from multi-tiered enterprise applications,,
Improving efficiency and resilience in large-scale computing systems through analytics and data-driven management,Forward,not-relevant,,Determining configuration parameter dependencies via analysis of configuration data from multi-tiered enterprise applications,,
Stigmergic interoperability for autonomic systems: Managing complex interactions in multi-manager scenarios,Forward,not-relevant,,Determining configuration parameter dependencies via analysis of configuration data from multi-tiered enterprise applications,,
Diagnosing Software Configuration Errors via Static Analysis,Forward,relevant,,Determining configuration parameter dependencies via analysis of configuration data from multi-tiered enterprise applications,,
Fast Extraction of Adaptive Change Point Based Patterns for Problem Resolution in Enterprise Systems,Backward,not-relevant,,Determining configuration parameter dependencies via analysis of configuration data from multi-tiered enterprise applications,,
Mining Activity Data for Dynamic Dependency Discovery in e-Business System,Backward,not-relevant,,Determining configuration parameter dependencies via analysis of configuration data from multi-tiered enterprise applications,,
Approaches to building self healing systems using dependency analysis,Backward,not-relevant,,Determining configuration parameter dependencies via analysis of configuration data from multi-tiered enterprise applications,,
